{
  "capstone_id": "CAP-001",
  "capstone_version": "PLACEHOLDER",
  "completed_at": "1970-01-01T00:00:00Z",
  "configuration_hash": "PLACEHOLDER",
  "data_version": "PLACEHOLDER",
  "formulation_classification": "EXACT",
  "formulation_type": "PLACEHOLDER",
  "git_commit": "PLACEHOLDER",
  "hard_violation_count": 0,
  "hardware_profile": "PLACEHOLDER",
  "input_checksums_hash": "PLACEHOLDER",
  "licence_access_route": "PLACEHOLDER",
  "max_quantity_residual": 0.0,
  "max_unit_cost_residual_eur_per_unit": 0.0,
  "max_value_residual_eur": 0.0,
  "method_description": "PLACEHOLDER",
  "model_version": "PLACEHOLDER",
  "number_of_starts": 0,
  "output_checksums_hash": "PLACEHOLDER",
  "random_seed": 0,
  "raw_termination_condition": "PLACEHOLDER",
  "reconciliation_pass_flag": false,
  "run_id": "PLACEHOLDER",
  "run_mode": "RECURSIVE_MINLP",
  "runtime_seconds": 0.0,
  "scenario_id": "BASE",
  "solver_name": "PLACEHOLDER",
  "solver_options_hash": "PLACEHOLDER",
  "started_at": "1970-01-01T00:00:00Z",
  "status": "globally_optimal",
  "success_flag": false,
  "termination_message": "PLACEHOLDER"
}
